<?xml version="1.0" encoding="ISO-8859-1"?>
<!DOCTYPE regularPolygon SYSTEM "../../dtd/regularPolygon.dtd">

<regularPolygon>

	<name>r_star_16</name>
	<shapeType>REGULAR_POLYGON</shapeType>
	<totalPoints>16</totalPoints>
	<internalRadius>2</internalRadius>
	<offset>0</offset>
	<scaleX>1</scaleX>
	<scaleY>1</scaleY>
	<rotationAngle>22.5</rotationAngle>
	<transX>.5</transX>
	<transY>.5</transY>

</regularPolygon>
